{
  "schema_version": 1,
  "locale": "zh-Hant",
  "name": "繁體中文",
  "catalog_version": "0.9.113",
  "catalog_hash": "87180b70518374deb4185034260c42b09144ca6620c0563cf10bb9335f4de400",
  "status": "draft",
  "messages": {
    "android_manifest_text_0001": "復古貓",
    "android_save_directory_dialog_text_0001": "無法讀取 Android 存檔目錄",
    "android_save_directory_dialog_text_0002": "選擇存檔目錄",
    "android_save_directory_dialog_text_0004": "此目錄沒有子資料夾",
    "android_save_directory_dialog_text_0006": "系統目錄授權",
    "android_save_directory_dialog_text_0007": "使用此目錄",
    "background_transfers_text_0028": "背景傳輸",
    "background_transfers_text_0030": "復古貓 · %1$s",
    "baidu_connection_dialog_text_0001": "正在連線百度網盤",
    "baidu_connection_dialog_text_0002": "正在驗證百度授權",
    "baidu_connection_dialog_text_0004": "連線百度網盤",
    "baidu_connection_dialog_text_0005": "更新百度授權",
    "baidu_connection_dialog_text_0006": "開啟授權網頁，選擇百度網盤並使用網站提供的應用程式參數登入授權，再將 Refresh Token 貼至下方。",
    "baidu_connection_dialog_text_0007": "無法開啟授權網頁：%1$s",
    "baidu_connection_dialog_text_0008": "取得授權",
    "baidu_connection_dialog_text_0009": "Refresh Token（更新權杖）",
    "baidu_connection_dialog_text_0010": "已驗證帳號：%1$s",
    "baidu_connection_dialog_text_0011": "檢查連線",
    "baidu_connection_dialog_text_0013": "連線並選擇目錄",
    "baidu_connection_dialog_text_0014": "更新授權",
    "common_back": "返回",
    "common_cancel": "取消",
    "common_cancelling": "正在取消",
    "common_choose_platform": "選擇機種",
    "common_close": "關閉",
    "common_download": "下載",
    "common_file": "檔案",
    "common_folder": "資料夾",
    "common_not_recorded": "未記錄",
    "common_parent_folder": "上一層",
    "common_save": "儲存",
    "common_save_failed": "儲存未完成：%1$s",
    "common_saving": "正在儲存",
    "common_upload": "上傳",
    "community_catalog_dialog_text_0001": "上次目錄讀取失敗：%1$s",
    "community_catalog_dialog_text_0002": "正在停止下載…",
    "community_catalog_dialog_text_0003": "正在下載並安裝 %1$s/%2$s：%3$s",
    "community_catalog_dialog_text_0006": "下載已停止，已安裝的擴充保留",
    "community_catalog_dialog_text_0007": "社群機種",
    "community_catalog_dialog_text_0008": "社群主題",
    "community_catalog_dialog_text_0009": "勾選需要的機種擴充。安裝後可加入對應的 ROM 目錄。",
    "community_catalog_dialog_text_0010": "勾選喜歡的主題。安裝後可在主題設定中預覽並套用。",
    "community_catalog_dialog_text_0013": "已安裝紀錄讀取失敗：%1$s",
    "community_catalog_dialog_text_0014": "尚無可用的線上目錄",
    "community_catalog_dialog_text_0015": "社群暫未發佈此類擴充",
    "community_catalog_dialog_text_0016": "已選 %1$s 項 / %2$s 項",
    "community_catalog_dialog_text_0017": "取消全選",
    "community_catalog_dialog_text_0018": "全選",
    "community_catalog_dialog_text_0019": "正在停止",
    "community_catalog_dialog_text_0020": "停止下載",
    "community_catalog_dialog_text_0022": "下載並安裝（%1$s）",
    "community_catalog_dialog_text_0023": "機種圖示",
    "community_catalog_dialog_text_0024": "主題縮圖",
    "community_catalog_dialog_text_0025": "%1$s未提供%2$s",
    "community_catalog_dialog_text_0030": "需要復古貓 %1$s 或更新版本",
    "community_catalog_showing_cache": "線上目錄暫不可用：%1$s；顯示上次取得的目錄",
    "community_catalog_unavailable": "線上目錄暫不可用：%1$s",
    "community_install_partial": "已安裝 %1$s 項，%2$s 項失敗，可重新選擇下載",
    "community_install_succeeded": "已安裝 %1$s 項",
    "community_installed_author": "%1$s · v%2$s · 已安裝",
    "community_pack_settings_text_0003": "瀏覽機種圖示，多選下載機種擴充",
    "community_pack_settings_text_0004": "瀏覽主題縮圖，多選下載主題",
    "controls_label_0001": "上一個頂欄頁面",
    "controls_label_0002": "下一個頂欄頁面",
    "controls_label_0003": "上一個機種",
    "controls_label_0004": "下一個機種",
    "controls_label_0005": "遊戲操作選單",
    "controls_label_0006": "收藏 / 取消收藏",
    "controls_label_0007": "媒體預覽設定",
    "disc_licenses_dialog_text_0001": "光碟讀取元件授權",
    "disc_licenses_dialog_text_0002": "啟動音效來源與授權",
    "disc_licenses_dialog_text_0003": "機種圖示來源與授權",
    "disc_licenses_dialog_text_0004": "保留元件原始授權文字。可觸控捲動，也可使用下方翻頁按鈕閱讀。",
    "disc_licenses_dialog_text_0005": "授權文字結束",
    "disc_licenses_dialog_text_0006": "授權文字讀取失敗：%1$s",
    "disc_licenses_dialog_text_0007": "上一頁",
    "disc_licenses_dialog_text_0008": "下一頁",
    "emulator_settings_text_0001": "還沒有可設定的機種",
    "emulator_settings_text_0002": "加入 ROM 後，相應機種會自動出現在這裡。",
    "emulator_settings_text_0009": "尚未選擇預設模擬器",
    "emulator_settings_text_0010": "%1$s · 模擬器",
    "emulator_settings_text_0011": "此機種的啟動適配尚未完成",
    "emulator_settings_text_0012": "仍可管理遊戲、封面與資料。",
    "emulator_settings_text_0013": "入口可用",
    "emulator_settings_text_0014": "未找到啟動入口",
    "emulator_settings_text_0015": "預設模擬器",
    "emulator_settings_text_0017": "請選擇啟動的模擬器核心",
    "emulator_settings_text_0018": "原有自訂核心",
    "emulator_settings_text_0022": "設為預設",
    "folder_mapping_dialog_text_0001": "%1$s 的同步對應",
    "folder_mapping_dialog_text_0003": "ROM 目錄",
    "folder_mapping_dialog_text_0004": "媒體目錄",
    "folder_mapping_dialog_text_0005": "一個本機目錄對應一個遠端目錄。儲存對應不會移動或刪除檔案；離線時也可以填寫並儲存。",
    "folder_mapping_dialog_text_0006": "還沒有 WebDAV 來源，此目錄仍可用於本機遊戲。",
    "folder_mapping_dialog_text_0007": "加入 WebDAV 來源",
    "folder_mapping_dialog_text_0008": "選擇來源",
    "folder_mapping_dialog_text_0009": "遠端資料夾",
    "folder_mapping_dialog_text_0010": "例如：GB/roms",
    "folder_mapping_dialog_text_0011": "相對於來源根目錄，留空表示根目錄。",
    "folder_mapping_dialog_text_0012": "在此目錄中分開放置 ROM 與各類媒體",
    "folder_mapping_dialog_text_0013": "在此目錄中按媒體類型分資料夾",
    "folder_mapping_dialog_text_0014": "瀏覽遠端資料夾",
    "folder_mapping_dialog_text_0015": "正在儲存對應",
    "folder_mapping_dialog_text_0016": "解除對應",
    "folder_mapping_dialog_text_0018": "儲存對應",
    "folder_mapping_dialog_text_0019": "解除同步對應",
    "folder_mapping_dialog_text_0020": "解除「%1$s」與遠端目錄的關聯。保留兩端的檔案、本機遊戲資料、收藏和存檔。",
    "folder_mapping_dialog_text_0021": "確認解除",
    "folder_mapping_dialog_text_0022": "選擇 WebDAV 來源",
    "folder_mapping_dialog_text_0024": "選擇遠端資料夾",
    "folder_mapping_dialog_text_0026": "重新檢查目錄",
    "folder_mapping_dialog_text_0027": "沒有子資料夾，可以選擇目前目錄。",
    "folder_mapping_dialog_text_0030": "選擇此資料夾",
    "folder_scan_dialog_text_0001": "選擇遊戲機種",
    "folder_scan_dialog_text_0002": "「%1$s」未能自動辨識機種。可以選擇機種，也可以略過此目錄，繼續匯入其他目錄。",
    "folder_scan_dialog_text_0003": "機種",
    "folder_scan_dialog_text_0005": "略過此目錄",
    "folder_scan_dialog_text_0006": "繼續匯入",
    "folder_scan_dialog_text_0007": "選擇相容索引",
    "folder_scan_dialog_text_0008": "「%1$s」發現多份索引，請選擇要讀取的檔案。天馬的分拆索引可同時勾選。",
    "folder_scan_dialog_text_0009": "後續重新整理沿用本次選擇；索引檔案增減時重新選擇。",
    "folder_scan_dialog_text_0011": "讀取所選索引",
    "folder_scan_dialog_text_0012": "讀取遊戲資料夾",
    "folder_scan_dialog_text_0013": "掃描本機遊戲庫",
    "folder_scan_dialog_text_0014": "正在取消掃描",
    "folder_scan_dialog_text_0015": "已檢查 %1$s / %2$s 項",
    "folder_scan_dialog_text_0016": "正在結束目錄檢查，尚未匯入遊戲。",
    "folder_scan_dialog_text_0017": "正在檢查目錄和索引檔案是否存在。可以取消，稍後在設定中加入遊戲。",
    "folder_scan_dialog_text_0018": "正在結束目前讀取。本次遊戲紀錄不會儲存，資料夾設定和原有遊戲保留。",
    "folder_scan_dialog_text_0019": "正在一次性儲存 %1$s 個遊戲，請稍候。",
    "folder_scan_dialog_text_0020": "掃描完成後統一儲存遊戲紀錄。取消會保留資料夾設定和原有遊戲，可稍後重新掃描。",
    "folder_scan_dialog_text_0022": "取消掃描",
    "folder_settings_text_0001": "正在安裝機種擴充",
    "folder_settings_text_0002": "已安裝機種：%1$s",
    "folder_settings_text_0003": "遊戲庫資料夾列表",
    "folder_settings_text_0005": "匯入機種擴充包",
    "folder_settings_text_0006": "ZIP 內包含 platform.json 與機種圖示",
    "folder_settings_text_0009": "加入 ROM 目錄",
    "folder_settings_text_0010": "加入媒體目錄",
    "folder_settings_text_0011": "選擇 ROM 總目錄即可自動辨識機種子目錄、索引和媒體，也可加入單一機種目錄。每個本機資料夾只對應一個遠端資料夾；不設定對應也能使用本機遊戲。",
    "folder_settings_text_0012": "還沒有設定目錄",
    "folder_settings_text_0013": "先加入存放遊戲的 ROM 資料夾。",
    "folder_settings_text_0014": "正在讀取網盤機種目錄",
    "folder_settings_text_0015": "網盤中的機種目錄",
    "folder_settings_text_0016": "%1$s · %2$s 個雲端遊戲 · 選擇本機 ROM 目錄後可下載",
    "folder_settings_text_0017": "關聯目錄",
    "folder_settings_text_0018": "網盤機種目錄讀取失敗：%1$s",
    "folder_settings_text_0023": "批次同步 %1$s",
    "folder_settings_text_0024": "批次同步",
    "folder_settings_text_0025": "正在檢查資料夾引用",
    "folder_settings_text_0026": "移除 %1$s",
    "folder_settings_text_0027": "設定同步對應",
    "folder_settings_text_0028": "已隱藏的遊戲",
    "folder_settings_text_0029": "取消隱藏，在遊戲庫中重新顯示",
    "folder_settings_text_0036": "移除資料夾",
    "folder_settings_text_0038": "重新顯示遊戲",
    "folder_settings_text_0039": "取消「%1$s」的隱藏狀態。收藏與遊玩紀錄保留，ROM、媒體和存檔不變。再次匯入原索引不會重新隱藏此遊戲。",
    "folder_settings_text_0040": "重新顯示",
    "folder_settings_text_0041": "對應已儲存",
    "folder_settings_text_0042": "正在檢查遠端目錄",
    "folder_settings_text_0044": "已解除對應，兩端檔案保留",
    "game_action_dialog_text_0001": "操作 ROM：%1$s",
    "game_action_dialog_text_0003": "本機 ROM：%1$s · 雲端 ROM：%2$s",
    "game_action_dialog_text_0005": "編輯遊戲資料",
    "game_action_dialog_text_0006": "本機 ROM：%1$s",
    "game_action_dialog_text_0007": "遠端 ROM：%1$s",
    "game_action_dialog_text_0008": "此遊戲已從遠端庫中移除，本機項目和檔案仍保留。",
    "game_action_dialog_text_0009": "上傳資料",
    "game_action_dialog_text_0010": "本機上傳",
    "game_action_dialog_text_0011": "下載資料",
    "game_action_dialog_text_0013": "徹底移除雲端遊戲",
    "game_action_dialog_text_0014": "存檔歷史還原",
    "game_action_dialog_text_0015": "設定此遊戲的載體外觀",
    "game_action_dialog_text_0016": "多選遊戲",
    "game_action_dialog_text_0017": "正在更新收藏",
    "game_action_dialog_text_0018": "取消收藏",
    "game_action_dialog_text_0019": "加入收藏",
    "game_action_dialog_text_0020": "查看遊戲詳情",
    "game_action_dialog_text_0033": "正在儲存所選資料",
    "game_appearance_dialog_text_0011": "載體外觀",
    "game_appearance_dialog_text_0012": "單獨編輯",
    "game_appearance_dialog_text_0013": "已儲存的外觀",
    "game_appearance_dialog_text_0014": "未儲存",
    "game_appearance_dialog_text_0015": "外殼顏色",
    "game_appearance_dialog_text_0016": "模型預設顏色",
    "game_appearance_dialog_text_0017": "自訂色值",
    "game_appearance_dialog_text_0018": "#RRGGBB；留空使用模型預設顏色",
    "game_appearance_dialog_text_0019": "請輸入完整色值，例如 #7357A8",
    "game_appearance_dialog_text_0020": "外殼材質",
    "game_appearance_dialog_text_0021": "半透明塑膠可透出內部結構；只調整外殼，標籤圖片保持原色。",
    "game_appearance_dialog_text_0023": "全域設定",